{
  "name": "BattlefieldList",
  "opcode": "smsg_battlefield_list",
  "direction": "server",
  "fields": [
    {
      "name": "battlemaster",
      "type": "uint64"
    },
    {
      "name": "map",
      "type": "uint32"
    },
    {
      "name": "bracket",
      "type": "BattlegroundBracket"
    },
    {
      "name": "number_of_battlegrounds",
      "type": "uint32"
    },
    {
      "name": "battlegrounds",
      "type": "u32",
      "array": {
        "count_field": "number_of_battlegrounds"
      }
    }
  ]
}