{
  "name": "MoveHoverAck",
  "opcode": "cmsg_move_hover_ack",
  "direction": "client",
  "fields": [
    {
      "name": "guid",
      "type": "uint64"
    },
    {
      "name": "counter",
      "type": "uint32"
    },
    {
      "name": "info",
      "type": "MovementInfo"
    },
    {
      "name": "is_applied",
      "type": "uint32"
    }
  ]
}