{
  "name": "LootStartRoll",
  "opcode": "smsg_loot_start_roll",
  "direction": "server",
  "fields": [
    {
      "name": "creature",
      "type": "uint64"
    },
    {
      "name": "loot_slot",
      "type": "uint32"
    },
    {
      "name": "item",
      "type": "Item"
    },
    {
      "name": "item_random_suffix",
      "type": "uint32"
    },
    {
      "name": "item_random_property_id",
      "type": "uint32"
    },
    {
      "name": "countdown_time",
      "type": "Milliseconds"
    }
  ]
}