{
  "name": "PvpLogDataServer",
  "opcode": "msg_pvp_log_data_server",
  "direction": "server",
  "fields": [
    {
      "name": "status",
      "type": "BattlegroundEndStatus"
    },
    {
      "name": "amount_of_players",
      "type": "uint32"
    },
    {
      "name": "players",
      "type": "BattlegroundPlayer",
      "array": {
        "count_field": "amount_of_players"
      }
    }
  ]
}