{
  "name": "CompressedUpdateObject",
  "opcode": "smsg_compressed_update_object",
  "direction": "server",
  "fields": [
    {
      "name": "amount_of_objects",
      "type": "uint32"
    },
    {
      "name": "has_transport",
      "type": "uint8"
    },
    {
      "name": "objects",
      "type": "Object",
      "array": {
        "count_field": "amount_of_objects"
      }
    }
  ]
}