{
  "name": "ForceSwimBackSpeedChangeAck",
  "opcode": "cmsg_force_swim_back_speed_change_ack",
  "direction": "client",
  "fields": [
    {
      "name": "guid",
      "type": "uint64"
    },
    {
      "name": "counter",
      "type": "uint32"
    },
    {
      "name": "info",
      "type": "MovementInfo"
    },
    {
      "name": "new_speed",
      "type": "float"
    }
  ]
}