{
  "name": "TransferAborted",
  "opcode": "smsg_transfer_aborted",
  "direction": "server",
  "fields": [
    {
      "name": "map",
      "type": "uint32"
    },
    {
      "name": "reason",
      "type": "TransferAbortReason"
    },
    {
      "name": "argument",
      "type": "uint8"
    }
  ]
}